{
  "id": "comparison",
  "name": "Comparison (A vs B)",
  "tl": "Paghahambing (A vs B)",
  "about": "A versus B: a big A VS B header, the two sides on screen if you give a second video, and checklists for each.",
  "about_tl": "A laban sa B: malaking A VS B, at ang dalawang panig kung may pangalawang video.",
  "inputs": [
    {
      "role": "main",
      "kinds": [
        "video"
      ],
      "required": true,
      "label": "You talking",
      "tl": "Ikaw na nagsasalita"
    },
    {
      "role": "second",
      "kinds": [
        "video"
      ],
      "required": false,
      "label": "The other side (optional)",
      "tl": "Ang kabilang panig (kung meron)"
    }
  ],
  "keywords": [
    "vs",
    "versus",
    "comparison",
    "compare",
    "a vs b",
    "alin ang mas"
  ],
  "edit": {},
  "captions": {},
  "graphics": {
    "style": "news"
  },
  "instruction": "",
  "steps": [
    {
      "op": "layout",
      "type": "split",
      "with": "second",
      "ratio": 0.5,
      "optional": true
    },
    {
      "op": "versus",
      "template": "versus-split"
    }
  ]
}
